{
  "request_id": "REQ-0812",
  "tenant_id": "TENANT-LOCAL",
  "intent": "urn:core:summary:summary_to_file",
  "risk_score": 0.1,
  "dry_run": true,
  "side_effect_policy": "none",
  "idempotency_key": "TENANT-LOCAL:REQ-0812",
  "budget": { "max_tokens": 2000, "max_attempts": 2 },
  "context": { "input_path": "fixtures/huge.md" }
}

