{
  "request_id": "REQ-0810",
  "tenant_id": "TENANT-LOCAL",
  "intent": "urn:core:summary:summary_to_file",
  "risk_score": 0.1,
  "dry_run": false,
  "side_effect_policy": "draft",
  "idempotency_key": "TENANT-LOCAL:REQ-0810",
  "budget": { "max_tokens": 2000, "max_attempts": 2 },
  "context": { "output_path": "../pwn.md" }
}
